<?xml version="1.0" encoding="ISO-8859-1" standalone="no" ?>
<!DOCTYPE CV SYSTEM "CV.dtd">
<CV>
	<Entete>
		<Etudiant Numero="10604950">
			<Nom>Mathéossian
			</Nom>
			<Prenom>Dimitri
			</Prenom>
			<Adresse>50 avenue ! 
			</Adresse>
			<Adresse>69150 Décines
			</Adresse>
			<Telephone>+33 4 00 00 00 00
			</Telephone>
			<Email>dimitri.matheossian@etu.univ-lyon1.fr
			</Email>
		</Etudiant>
		<Titre>Curriculum vitae
		</Titre>
	</Entete>
	<Rubrique Titre="Stages">
		<Item>
			<Date>2010
			</Date>
			<Contenu>  Intégrateur Webdeveloppeur
			</Contenu>
		</Item>
	</Rubrique>
	<Rubrique Titre="Competences">
		<Item>
			<SousTitre>Langages informatiques
			</SousTitre>
			<Contenu>XHTML/CSS
			</Contenu>
			<Contenu>C++/C/JAVA/
			</Contenu>
		</Item>
	</Rubrique>
</CV>
